kid,kid2,keyword,normalized
387,386,"Linearly recursive sequences, adic topologies, power series, Hopf algebras","linearly recursive sequences, adic topologies, power series, hopf algebra"
388,387,"Lobe, lobe-transitive, edge-transitive, orbit, connectivity","lobe, lobe-transitive, edge-transitive, orbit, connectivity"
389,388,"Locating-dominating number, convex polytopes","locating-dominating number, convex polytope"
390,389,"Lucas cube, Fibonacci cube, domination number, total domination number, integer linear programming","lucas cube, fibonacci cube, domination number, total domination number, integer linear programming"
391,390,"m-Cayley, circulant, strongly regular graphs, strongly regular digraphs, uniform partial sum families, almost-uniform partial sum families.","m-cayley, circulant, strongly regular graphs, strongly regular digraphs, uniform partial sum families, almost-uniform partial sum families."
392,391,"Majorana representations, association schemes, Monster algebra, Harada-Norton group","majorana representations, association schemes, monster algebra, harada-norton group"
393,392,"Map, flag graph, symmetry type graph, chamfering operation.","map, flag graph, symmetry type graph, chamfering operation."
394,393,"map, pre-map, graph, pre-graph, Cayley map","map, pre-map, graph, pre-graph, cayley map"
395,394,"Maps, graphs, Groups, parameterizations.","maps, graphs, groups, parameterizations."
396,395,"Maps, hypermaps, representation, polytopes, hypertopes","maps, hypermaps, representation, polytopes, hypertope"
397,396,"Maps, polytopes, groups, covers, Gaussian and Eisenstein integers","maps, polytopes, groups, covers, gaussian and eisenstein integer"
398,397,"Markov proceses, last exit decompositions, excursion theory","markov proceses, last exit decompositions, excursion theory"
399,398,"mathematical chemistry, topological index, revised Szeged index","mathematical chemistry, topological index, revised szeged index"
400,399,"Matrix semigroup, Homomorphism, Representation.","matrix semigroup, homomorphism, representation."
401,400,"Matroids, combinatorial rigidity, sparse graphs and hypergraphs","matroids, combinatorial rigidity, sparse graphs and hypergraph"
402,401,"Maximal matching, maximal matching polynomial, cactus graph, cactus chain, Padovan numbers, Perrin numbers, corona product","maximal matching, maximal matching polynomial, cactus graph, cactus chain, padovan numbers, perrin numbers, corona product"
403,402,"Maximal matching, maximal packing","maximal matching, maximal packing"
404,403,"Maximal matching, saturation number, lattice animal, polyomino graph, benzenoid graph, coronene","maximal matching, saturation number, lattice animal, polyomino graph, benzenoid graph, coronene"
405,404,Maximally non-hamiltonian digraphs,maximally non-hamiltonian digraph
406,405,"Maximum genus, Nebesky theorem, Betti number, cycle rank, connectivity","maximum genus, nebesky theorem, betti number, cycle rank, connectivity"
407,406,"maximum independent set, core, matching, unicyclic graph, Konig-Egervary graph","maximum independent set, core, matching, unicyclic graph, konig-egervary graph"
408,407,"Maximum independent set, matching, tree, bipartite graph, König-Egerváry graph, annihilation set, annihilation number","maximum independent set, matching, tree, bipartite graph, könig-egerváry graph, annihilation set, annihilation number"
409,408,"Maximum packing with triples, maximum packing with 6-cycles","maximum packing with triples, maximum packing with 6-cycle"
410,409,"Maxwell-Cremona correspondence, Grassmanian stratification, oriented matroid, equilibrium stress","maxwell-cremona correspondence, grassmanian stratification, oriented matroid, equilibrium stress"
411,410,"Metric spaces, metric dimension, k-metric dimension","metric spaces, metric dimension, k-metric dimension"
412,411,"Minimal covers, Regular and rotary maps, Eisenstein integers","minimal covers, regular and rotary maps, eisenstein integer"
413,412,"Mixed discriminants, symmetric matrix, mixed volume, Aleksandrov’s inequality.","mixed discriminants, symmetric matrix, mixed volume, aleksandrov’s inequality."
414,413,"Mixed fault diameter, Cartesian graph bundle, interconnection network, fault tolerance.","mixed fault diameter, cartesian graph bundle, interconnection network, fault tolerance."
415,414,"Möbius configuration, (8_4) configurations, Möbius pair, n-simplex","möbius configuration, (8_4) configurations, möbius pair, n-simplex"
416,415,"Modified Wiener index, canonical metric representation, partial cubes, fullerene patches, nanocones","modified wiener index, canonical metric representation, partial cubes, fullerene patches, nanocone"
417,416,"Modified Wiener index, graph operation, automorphism group","modified wiener index, graph operation, automorphism group"
418,417,"Monster algebra, Majorana, L2(11)","monster algebra, majorana, l2(11)"
419,418,"n-distance-balanced graph, cartesian product, lexicographic product","n-distance-balanced graph, cartesian product, lexicographic product"
420,419,"Near hexagons, Geometric hyperplanes, Veldkamp spaces","near hexagons, geometric hyperplanes, veldkamp space"
421,420,"Nonattacking chess pieces, Ehrhart theory, inside-out polytope, arrangement of hyperplanes, signed graph","nonattacking chess pieces, ehrhart theory, inside-out polytope, arrangement of hyperplanes, signed graph"
422,421,"Noncommutative frame, skew lattice, completeness, lattice section","noncommutative frame, skew lattice, completeness, lattice section"
423,422,"Normal, bi-Cayley, Cartesian product.","normal, bi-cayley, cartesian product."
424,423,"Normalizer, non-nilpotent subgroup, self-normalizing subgroup","normalizer, non-nilpotent subgroup, self-normalizing subgroup"
425,424,"Nowhere-zero flow, Cayley graph, Tutte's 3-flow conjecture, connection sequence, solvable group, nilpotent group","nowhere-zero flow, cayley graph, tutte's 3-flow conjecture, connection sequence, solvable group, nilpotent group"
426,425,"NSSD, G-nutful graph, circulant matrix, complete graph.","nssd, g-nutful graph, circulant matrix, complete graph."
427,426,"Nuciferous graph, Cayley graph","nuciferous graph, cayley graph"
428,427,"Nuficerous graph, chemical graph, NSSD, non-singular graph, molecular conductivity","nuficerous graph, chemical graph, nssd, non-singular graph, molecular conductivity"
429,428,"Nullity, core vertices, key-graphs,  superimposition, circuit","nullity, core vertices, key-graphs, superimposition, circuit"
430,429,"Oberwolfach problem, graph factorisations, graph decompositions, 2-factorisations","oberwolfach problem, graph factorisations, graph decompositions, 2-factorisation"
431,430,"One-regular graphs, 4-valent, Cayley graphs","one-regular graphs, 4-valent, cayley graph"
432,431,"Optimal stopping for Markov chains, equity-linked life insurance with guarantees","optimal stopping for markov chains, equity-linked life insurance with guarantees"
433,432,"Oriented hypergraphs, 1-2-3 conjecture, combinatorial nullstellensatz, list weighting","oriented hypergraphs, 1-2-3 conjecture, combinatorial nullstellensatz, list weighting"
434,433,"p-group, regular abelian subgroup, automorphism group","p-group, regular abelian subgroup, automorphism group"
435,434,"Packing chromatic number, hexagonal lattice, square lattice, computer search","packing chromatic number, hexagonal lattice, square lattice, computer search"
436,435,"Packing chromatic number, i-packing, hexagonal lattice, square lattice, triangular lattice, distance coloring.","packing chromatic number, i-packing, hexagonal lattice, square lattice, triangular lattice, distance coloring."
437,436,"Palette index, edge-coloring, interval edge-coloring","palette index, edge-coloring, interval edge-coloring"
438,437,"Parallelogram law, parallelotope","parallelogram law, parallelotope"
439,438,Partial orders,partial order
440,439,"Partitions, combinatorial identities, bijective combinatorics","partitions, combinatorial identities, bijective combinatorics"
441,440,"Perfect matching derangement graph, independent sets, Erdős-Ko-Rado theorem","perfect matching derangement graph, independent sets, erdős-ko-rado theorem"
442,441,"Perfect matching, Pfaffian graph, fullerene graph, Hadamard-Fischer inequality","perfect matching, pfaffian graph, fullerene graph, hadamard-fischer inequality"
443,442,"Permanent, indecomposable matrices, graphs","permanent, indecomposable matrices, graph"
444,443,Permutation group,permutation group
445,444,"Permutation group, imprimitive group","permutation group, imprimitive group"
446,445,"Permutation group, primitive group, vertex-transitive graph, semisymmetric graph","permutation group, primitive group, vertex-transitive graph, semisymmetric graph"
447,446,"Permutation polytopes, dihedral groups, lattice polytopes","permutation polytopes, dihedral groups, lattice polytope"
448,447,"Permutation, Dyck path, pattern avoidance, Hankel transform","permutation, dyck path, pattern avoidance, hankel transform"
449,448,"Petersen colorings, strong Petersen colorings, snarks","petersen colorings, strong petersen colorings, snark"
450,449,"Planar graph, thickness, complete bipartite graph","planar graph, thickness, complete bipartite graph"
451,450,"planar graphs, distinguishing number, distinguishing chromatic number","planar graphs, distinguishing number, distinguishing chromatic number"
452,451,"Planar triangulation, cubic graph, generation, recursive structure.","planar triangulation, cubic graph, generation, recursive structure."
453,452,"planar, automorphism group, primitive group, planar discontinuous group, residually finite, 1-ended","planar, automorphism group, primitive group, planar discontinuous group, residually finite, 1-ended"
454,453,plane graph,plane graph
455,454,"Plane graph, alternating degrees, exhaustive search, heuristic search.","plane graph, alternating degrees, exhaustive search, heuristic search."
456,455,"Plane graph, edge coloring.","plane graph, edge coloring."
457,456,"Plane graph, facial walk, edge colouring.","plane graph, facial walk, edge colouring."
458,457,"Plane graph, girth, edge weight, dual edge weight","plane graph, girth, edge weight, dual edge weight"
459,458,"Plane triangulation, Eulerian circuit, 3-colorable, Heawood's Theorem","plane triangulation, eulerian circuit, 3-colorable, heawood's theorem"
460,459,"Plurality strategy, median, majority rule, Hamming graph, Johnson graph, halfcube.","plurality strategy, median, majority rule, hamming graph, johnson graph, halfcube."
461,460,"Point-line configuration, pseudo-line, 2-manifold","point-line configuration, pseudo-line, 2-manifold"
462,461,"Point-line incidence graph, resolving sets, finite projective spaces","point-line incidence graph, resolving sets, finite projective space"
463,462,"Polar space, projective space, semiaffine space, slit space, complement","polar space, projective space, semiaffine space, slit space, complement"
464,463,"Polyhedron, rotational orbit, Euler characteristic","polyhedron, rotational orbit, euler characteristic"
465,464,"Polyhedron, static equilibrium, monostatic polyhedron, f-vector","polyhedron, static equilibrium, monostatic polyhedron, f-vector"
466,465,polyomino,polyomino
467,466,"Poset, order-chain polytope, unimodular equivalence","poset, order-chain polytope, unimodular equivalence"
468,467,"Positional games, k-in-a-row game, pairing strategies, symmetries","positional games, k-in-a-row game, pairing strategies, symmetry"
469,468,"Product-irregular labeling, product irregularity strength, tree","product-irregular labeling, product irregularity strength, tree"
470,469,"Projective arrangements, point-line incidence structure, (n_k) configurations.","projective arrangements, point-line incidence structure, (n_k) configurations."
471,470,"Projective special linear groups, coset geometries, locally s-arc-transitive graphs","projective special linear groups, coset geometries, locally s-arc-transitive graph"
472,471,"Projective special linear groups, coset geometries.","projective special linear groups, coset geometries."
473,472,pseudocyclic association schemes,pseudocyclic association scheme
474,473,"Pseudoline arrangement, quasiline arrangement, projective plane, incidence structure, combinatorial configuration, topological configuration, geometric configuration, sweep, wiring diagram, allowable sequence of permutations, maps on surfaces","pseudoline arrangement, quasiline arrangement, projective plane, incidence structure, combinatorial configuration, topological configuration, geometric configuration, sweep, wiring diagram, allowable sequence of permutations, maps on surface"
475,474,"Pursuit game, Cops and Robber, catch time.","pursuit game, cops and robber, catch time."
476,475,"Pursuit-evasion, lion and man, CAT(0) space, motion planning","pursuit-evasion, lion and man, cat(0) space, motion planning"
477,476,"Quadrangulation, closed surface, generating theorem","quadrangulation, closed surface, generating theorem"
478,477,"Quadrangulation, projective plane, generating theorem","quadrangulation, projective plane, generating theorem"
479,478,"Quaternionic power series, bidegree full functions, Hamming graph, linearly independent quaternionic monomials","quaternionic power series, bidegree full functions, hamming graph, linearly independent quaternionic monomial"
480,479,"r-inflation,  thickness, chromatic number, fractional chromatic number, arboricity","r-inflation, thickness, chromatic number, fractional chromatic number, arboricity"
481,480,"Reducibility, semigroups, commutators, nilpotent operators.","reducibility, semigroups, commutators, nilpotent operators."
482,481,"Regular balanced Cayley map, minimal non-abelian group, metacyclic group","regular balanced cayley map, minimal non-abelian group, metacyclic group"
483,482,"Regular dessin, bicyclic group, skew-morphism, graph embedding","regular dessin, bicyclic group, skew-morphism, graph embedding"
484,483,"Regular embedding, multiple edge, Holder’s Theorem, Mobius map.","regular embedding, multiple edge, holder’s theorem, mobius map."
485,484,"Regular map, automorphism group, self-dual map, self-Petrie-dual map","regular map, automorphism group, self-dual map, self-petrie-dual map"
486,485,"Regular map, complete bipartite graph, product of cyclic groups.","regular map, complete bipartite graph, product of cyclic groups."
487,486,"Regular map, linear fractional group.","regular map, linear fractional group."
488,487,"Regular map, O'Nan sporadic simple group, subgroup lattice, character table","regular map, o'nan sporadic simple group, subgroup lattice, character table"
489,488,"Regular map, Petrie polygon, Fibonacci sequence","regular map, petrie polygon, fibonacci sequence"
490,489,"Regular map, regular hypermap, covering space, permutation group, category","regular map, regular hypermap, covering space, permutation group, category"
491,490,"Regular polygonal system, boundary code, face vector, symmetry group, reconstructibility from the boundary","regular polygonal system, boundary code, face vector, symmetry group, reconstructibility from the boundary"
492,491,"Regular subgroup, Cayley isomorphism","regular subgroup, cayley isomorphism"
493,492,"Regularity, chirality, toroidal, thin geometries, hypermaps, abstract polytopes","regularity, chirality, toroidal, thin geometries, hypermaps, abstract polytope"
494,493,"Residual voluntary health insurance, equalization scheme, claims equalization, risk equalization.","residual voluntary health insurance, equalization scheme, claims equalization, risk equalization."
495,494,"Ribbon graph, medial graph, Petrie dual, extremal minor, orientation","ribbon graph, medial graph, petrie dual, extremal minor, orientation"
496,495,"Riemann surface, algebraic curve, dessin d’enfant","riemann surface, algebraic curve, dessin d’enfant"
497,496,"Riemann surface, graph, hyperelliptic graph, fundamental group, automorphism group, harmonic map, branched covering, graph of groups","riemann surface, graph, hyperelliptic graph, fundamental group, automorphism group, harmonic map, branched covering, graph of group"
498,497,"Riemann surface, regular map, Hurwitz map, reflection, mirror","riemann surface, regular map, hurwitz map, reflection, mirror"
499,498,"Robust cycle basis, forced commutativity of groupoid diagram, Cayley graph","robust cycle basis, forced commutativity of groupoid diagram, cayley graph"
500,499,"Roman domination, double Roman domination, cardinal products of graphs, paths, cycles","roman domination, double roman domination, cardinal products of graphs, paths, cycle"
501,500,"Rose window graphs, automorphism group, isomorphism problem, vertex-transitive graph","rose window graphs, automorphism group, isomorphism problem, vertex-transitive graph"
502,501,"rq-convex sets, parallelotopes, finite sets, Platonic solids","rq-convex sets, parallelotopes, finite sets, platonic solid"
503,502,"Saturation number, maximal matching, edge domination number, efficient edge dominating set, closed benzenoid chain, armchair nanotube, zig-zag nanotube, tubulene, TUC_4C_8(S) nanotube, TUC_4C_8(R) nanotube","saturation number, maximal matching, edge domination number, efficient edge dominating set, closed benzenoid chain, armchair nanotube, zig-zag nanotube, tubulene, tuc_4c_8(s) nanotube, tuc_4c_8(r) nanotube"
504,503,"Scattered linear set, MRD-code, linearized polynomial","scattered linear set, mrd-code, linearized polynomial"
505,504,"Schur numbers, anti-Ramsey numbers, rainbow triangles, Gallai colorings","schur numbers, anti-ramsey numbers, rainbow triangles, gallai coloring"
506,505,"Semifields, spreads, symplectic polarity, linear sets, Veronese variety","semifields, spreads, symplectic polarity, linear sets, veronese variety"
507,506,"Separator, graph, search, grid","separator, graph, search, grid"
508,507,"Sequence, convergence, Cesaro mean, binomial mean, finite Markov chain","sequence, convergence, cesaro mean, binomial mean, finite markov chain"
509,508,"Signed graph, negative cycle vector, permutable matching","signed graph, negative cycle vector, permutable matching"
510,509,"Signed graph‎, ‎spectrum","signed graph‎, ‎spectrum"
511,510,"Signed graph, switching equivalent signed graphs, adjacency matrix, net-balanced signed graph","signed graph, switching equivalent signed graphs, adjacency matrix, net-balanced signed graph"
512,511,"Signless Laplacian Estrada index, semi-edge walk, cut edge, vertex connectivity, edge connectivity","signless laplacian estrada index, semi-edge walk, cut edge, vertex connectivity, edge connectivity"
513,512,Simplicial arrangement,simplicial arrangement
514,513,"Skew lattices, Heyting algebras, non-commutative algebra, intuitionistic logic","skew lattices, heyting algebras, non-commutative algebra, intuitionistic logic"
515,514,"Solvable group, semiregular automorphism, fixed-point-free automorphism, polycirculant conjecture","solvable group, semiregular automorphism, fixed-point-free automorphism, polycirculant conjecture"
516,515,spanning forests,spanning forest
517,516,"spanning tree leaves, vulnerability, Hamiltonian path","spanning tree leaves, vulnerability, hamiltonian path"
518,517,"Spanning tree, Jacobian group, I-graph, Petersen graph, Chebyshev polynomial","spanning tree, jacobian group, i-graph, petersen graph, chebyshev polynomial"
519,518,"spatial conguration, Platonic solid, regular 4-polytope, product of congurations, incidence statement","spatial conguration, platonic solid, regular 4-polytope, product of congurations, incidence statement"
520,519,"Spectral radius of graph, graph energy, complete multipartite graph, complete split graph, Turán graph","spectral radius of graph, graph energy, complete multipartite graph, complete split graph, turán graph"
521,520,"Spectrum and eigenvalues of graphs, graphs with exactly two non-negative eigenvalues","spectrum and eigenvalues of graphs, graphs with exactly two non-negative eigenvalue"
522,521,"Spherical latin bitrade, canonical group, abelian sand-pile group","spherical latin bitrade, canonical group, abelian sand-pile group"
523,522,"Spherical quadrangle, rational angle, spherical tiling","spherical quadrangle, rational angle, spherical tiling"
524,523,"Spherical tiling by congruent quadrangles, monohedral tiling, quadrangulation.","spherical tiling by congruent quadrangles, monohedral tiling, quadrangulation."
525,524,"Steiner triple system, group action, difference family, Skolem sequence, Langford sequence","steiner triple system, group action, difference family, skolem sequence, langford sequence"
526,525,"Stock returns, internet search data, market regimes, trading strategies.","stock returns, internet search data, market regimes, trading strategies."
527,526,"Strong metric dimension, Sierpiński graphs","strong metric dimension, sierpiński graph"
528,527,"Strongly light subgraph, 1-planar graph.","strongly light subgraph, 1-planar graph."
529,528,strongly regular graph,strongly regular graph
530,529,"strongly regular graphs, vertex-transitive graphs, edge-  transitive graphs, normal quotient reduction, automorphism group","strongly regular graphs, vertex-transitive graphs, edge-transitive graphs, normal quotient reduction, automorphism group"
531,530,"Subconstituent algebra, Terwilliger algebra, distance-regular graph","subconstituent algebra, terwilliger algebra, distance-regular graph"
532,531,"Subcubic graph, odd edge-coloring, odd chromatic index, odd edge-covering, T-join","subcubic graph, odd edge-coloring, odd chromatic index, odd edge-covering, t-join"
533,532,"Subtrees, normal distribution, homeomorphically irreducible trees, random trees","subtrees, normal distribution, homeomorphically irreducible trees, random tree"
534,533,"Sum of squares, semidefinite programming, noncommutative polynomial, Matlab toolbox, commutator, cyclic equivalence, free positivity, real algebraic geometry, Motzkin polynomial, Bessis- Moussa-Villani (BMV) conjecture, NCSOStools.","sum of squares, semidefinite programming, noncommutative polynomial, matlab toolbox, commutator, cyclic equivalence, free positivity, real algebraic geometry, motzkin polynomial, bessis-moussa-villani (bmv) conjecture, ncsostools."
535,534,"Summed r-Lah numbers, r-Lah polynomials","summed r-lah numbers, r-lah polynomial"
536,535,"Super connectivity, direct product, vertex-cut.","super connectivity, direct product, vertex-cut."
537,536,"Supercharacter theory‎, ‎superclass‎, ‎conjugacy class‎, ‎irreducible character","supercharacter theory‎, ‎superclass‎, ‎conjugacy class‎, ‎irreducible character"
538,537,"Surface, orientable genus of a graph, join of two graphs","surface, orientable genus of a graph, join of two graph"
539,538,"Symmetric crosscap number, Klein surfaces","symmetric crosscap number, klein surface"
540,539,"Symmetric design, flag-transitive, point-primitive, point-imprimitive, automorphism group","symmetric design, flag-transitive, point-primitive, point-imprimitive, automorphism group"
541,540,"Symmetric genus, strong symmetric genus, Riemann surface, abelian groups, genus spectrum, density","symmetric genus, strong symmetric genus, riemann surface, abelian groups, genus spectrum, density"
542,541,"Symmetric graph, Cayley graph, bi-Cayley graph, regular cover","symmetric graph, cayley graph, bi-cayley graph, regular cover"
543,542,"Symmetric graph, normal quotient graph, automorphism group","symmetric graph, normal quotient graph, automorphism group"
544,543,"Symmetric graphs, Cayley graphs, quasiprimitive permutation groups, linear groups","symmetric graphs, cayley graphs, quasiprimitive permutation groups, linear group"
545,544,"Symmetric varieties, Schubert polynomials, wonderful compactification, equivariant cohomology, weak order, parabolic induction","symmetric varieties, schubert polynomials, wonderful compactification, equivariant cohomology, weak order, parabolic induction"
546,545,"Symmetry breaking, distinguishing index of a graph","symmetry breaking, distinguishing index of a graph"
547,546,"Symmetry type, vertex-transitive graph, arc-transitive graph, Cayley graph, Cartesian product, covering graph","symmetry type, vertex-transitive graph, arc-transitive graph, cayley graph, cartesian product, covering graph"
548,547,"Symmetry type, vertex-transitive graph, arc-transitive graph, Cayley graph, zero-symmetric graph, Cartesian product, covering graph","symmetry type, vertex-transitive graph, arc-transitive graph, cayley graph, zero-symmetric graph, cartesian product, covering graph"
549,548,"Szeged index, edge Szeged index, revised Szeged index, revised edge Szeged index.","szeged index, edge szeged index, revised szeged index, revised edge szeged index."
550,549,"Temporal network, semiring, algorithm, network measures, Python library, violence.","temporal network, semiring, algorithm, network measures, python library, violence."
551,550,"Tensegrities, equilibrium, surgeries.","tensegrities, equilibrium, surgeries."
552,551,"Tetrahedral cages, pentahedral cages, discs","tetrahedral cages, pentahedral cages, disc"
553,552,"The Erdős-Ko-Rado theorem,  s-distance set, diameter graph, independent set, extremal set theory","the erdős-ko-rado theorem, s-distance set, diameter graph, independent set, extremal set theory"
554,553,"The irregularity of graph, the total irregularity of graph, Zagreb indices","the irregularity of graph, the total irregularity of graph, zagreb index"
555,554,"Thickness, 4-girth-thickness, complete tripartite graph","thickness, 4-girth-thickness, complete tripartite graph"
556,555,"Thickness, complete 3-partite graph, complete 4-partite graph","thickness, complete 3-partite graph, complete 4-partite graph"
557,556,"Thickness, complete tripartite graph, planar subgraphs decomposition","thickness, complete tripartite graph, planar subgraphs decomposition"
