kid,kid2,keyword,normalized
1,1, (im)primitive group, (im)primitive group
2,2, alternating group, alternating group
3,3, arc-transitive graph, arc-transitive graph
4,4, area generating function, area generating function
5,5, cage, cage
6,6, Cartesian product, cartesian product
7,7, commutator subgroup, commutator subgroup
8,8, convex subgraph, convex subgraph
9,9, cube polynomial, cube polynomial
10,10, degree, degree
11,11," dessin d'enfant, hypermap"," dessin d'enfant, hypermap"
12,12, Distance energy, distance energy
13,13, duality, duality
14,14, edge coloring, edge coloring
15,15, edge-amalgamation, edge-amalgamation
16,16, epimorphism, epimorphism
17,17, equivelar polytope, equivelar polytope
18,18, facial walk, facial walk
19,19, Finite Geometries, finite geometry
20,20, flat polytope, flat polytope
21,21, Frobenius groups, frobenius group
22,22, generalized Petersen graph, generalized petersen graph
23,23, generators, generator
24,24, genus distribution, genus distribution
25,25, girth, girth
26,26, graph algorithms, graph algorithm
27,27, graph polynomials, graph polynomial
28,28, half-arc-transitive graph, half-arc-transitive graph
29,29, Hamilton cycle, hamilton cycle
30,30, Hamilton path, hamilton path
31,31, hamiltonian cycle, hamiltonian cycle
32,32, hexagonal-celled, hexagonal-celled
33,33, injectivity radius, injectivity radius
34,34, internal and external active edges, internal and external active edge
35,35, isometric subgraph, isometric subgraph
36,36, Join, join
37,37," Kekul\\'e structure, perfect matching, distributive lattice, median graph"," kekul\\'e structure, perfect matching, distributive lattice, median graph"
38,38, linear programming duality, linear programming duality
39,39, Livingstone--Wagner Theorem, livingstone--wagner theorem
40,40, mixing, mixing
41,41, nearly convex column, nearly convex column
42,42, network models, network model
43,43, nilpotent group, nilpotent group
44,44, NMDS-Code, nmds-code
45,45, Paralell Backtracking search with isomorph rejection., paralell backtracking search with isomorph rejection.
46,46, partial cubes, partial cube
47,47, planar width, planar width
48,48, primitive groups, primitive group
49,49, Regular graphs., regular graphs.
50,50, regular hypermap, regular hypermap
51,51, semi-directed, semi-directed
52,52, semiregular group, semiregular group
53,53, Spectrum, spectrum
54,54, strongy distance-balanced, strongy distance-balanced
55,55, Symmetric Designs, symmetric design
56,56, symmetric group, symmetric group
57,57, Tranisitvity, tranisitvity
58,58, Tutte polynomial, tutte polynomial
59,59, weak discrepancy, weak discrepancy
60,60,(19_4)-configurations,(19_4)-configuration
61,61,"(n,3)-configuration, geometric configuration, anti-Pappian, rational coordinatization, elliptic curve","(n,3)-configuration, geometric configuration, anti-pappian, rational coordinatization, elliptic curve"
62,62,"(Rooted) near-4-regular map, separating cycle, Lagrangian inversion, enumerating function, asymptotic","(rooted) near-4-regular map, separating cycle, lagrangian inversion, enumerating function, asymptotic"
63,63,"05C15, 05C25, 05C38, 90B10","05c15, 05c25, 05c38, 90b10"
64,64,"1-planar graph, light graph","1-planar graph, light graph"
65,65,"1-planar graph, lightness, cycle, discharging","1-planar graph, lightness, cycle, discharging"
66,66,"2-design, automorphism group, primitivity, flag-transitivity.","2-design, automorphism group, primitivity, flag-transitivity."
67,67,"2-Distance-transitive graph, 2-arc-transitive graph, permutation group.","2-distance-transitive graph, 2-arc-transitive graph, permutation group."
68,68,"2-factorizations, Hamilton-Waterloo problem, Oberwolfach problem, cycle decomposition, resolvable decompositions","2-factorizations, hamilton-waterloo problem, oberwolfach problem, cycle decomposition, resolvable decomposition"
69,69,"2-factorizations, resolvable cycle decompositions, cycle systems,  (generalized) Oberwolfach problem, Hamilton-Waterloo problem","2-factorizations, resolvable cycle decompositions, cycle systems, (generalized) oberwolfach problem, hamilton-waterloo problem"
70,70,"2-neighbour-transitive, alphabet-almost-simple, automorphism groups, Hamming graph, completely transitive","2-neighbour-transitive, alphabet-almost-simple, automorphism groups, hamming graph, completely transitive"
71,71,"2-tree, maximal outerplanar, partition, Stirling numbers","2-tree, maximal outerplanar, partition, stirling number"
72,72,"2-trees, graph colouring, Gray codes, Hamilton cycles, reconfiguration problems","2-trees, graph colouring, gray codes, hamilton cycles, reconfiguration problem"
73,73,"3-sun system, embedding, difference set","3-sun system, embedding, difference set"
74,74,"Abelian group, constant sum partition, group distance magic labeling","abelian group, constant sum partition, group distance magic labeling"
75,75,"abstract chiral polytopes, almost simple groups","abstract chiral polytopes, almost simple group"
76,76,"abstract polytopes, regular polytopes, projective linear groups","abstract polytopes, regular polytopes, projective linear group"
77,77,"abstract regular or chiral polytopes, symmetric graphs","abstract regular or chiral polytopes, symmetric graph"
78,78,Abstract regular or uniform polytopes,abstract regular or uniform polytope
79,79,abstract regular polytope,abstract regular polytope
80,80,"Abstract regular polytope, equivelar polytope, flat polytope, tight polytope","abstract regular polytope, equivelar polytope, flat polytope, tight polytope"
81,81,"Abstract regular polytopes, Coxeter groups, alternating groups, string C-groups","abstract regular polytopes, coxeter groups, alternating groups, string c-group"
82,82,"Abstract regular polytopes, string C-groups, small Ree groups, permutation groups","abstract regular polytopes, string c-groups, small ree groups, permutation group"
83,83,"Achiral symmetry, chiral symmetry, equivalence of actions, finite group action, isometry, orbifold, symmetry","achiral symmetry, chiral symmetry, equivalence of actions, finite group action, isometry, orbifold, symmetry"
84,84,"Achromatic index, complete coloring, finite affine space, pseudoachromatic index","achromatic index, complete coloring, finite affine space, pseudoachromatic index"
85,85,"Acyclic coloring, maximum degree","acyclic coloring, maximum degree"
86,86,"Additive permutation, Skolem sequence, transversal","additive permutation, skolem sequence, transversal"
87,87,"Adjacency matrix, characteristic polynomial, molecular conduction, eigenvalues, weighted graphs","adjacency matrix, characteristic polynomial, molecular conduction, eigenvalues, weighted graph"
88,88,"Adjacency matrix, graph eigenvalues, star complement, divisor concept, mathematical software","adjacency matrix, graph eigenvalues, star complement, divisor concept, mathematical software"
89,89,"Adjacency matrix, least eigenvalue, root system, signed line graph, exceptional signed graph, signed graph decomposition","adjacency matrix, least eigenvalue, root system, signed line graph, exceptional signed graph, signed graph decomposition"
90,90,"adjacency matrix, nut fullerenes, eigenvectors","adjacency matrix, nut fullerenes, eigenvector"
91,91,"adjacency matrix, singular graphs, nullity, extremal singular graphs, singular congurations, core width","adjacency matrix, singular graphs, nullity, extremal singular graphs, singular congurations, core width"
92,92,"adjacency matrix, singular graphs, nut graphs,   uniform core graphs, interlacing.","adjacency matrix, singular graphs, nut graphs,  uniform core graphs, interlacing."
93,93,"Aggregates, omittable lines","aggregates, omittable line"
94,94,"Algebraic number field, relative size, relative normalised size, Mahler measure, Schur-Siegel-Smyth trace problem","algebraic number field, relative size, relative normalised size, mahler measure, schur-siegel-smyth trace problem"
95,95,"Algorithm, abelian cover, Cayley voltages, covering projection, graph,  group extension, group presentation, lifting automorphisms,  linear systems over the integers,  semidirect product.","algorithm, abelian cover, cayley voltages, covering projection, graph, group extension, group presentation, lifting automorphisms,  linear systems over the integers,  semidirect product."
96,96,"Algorithm, graph, group extension, lifting automorphisms, regular covering projection, voltages","algorithm, graph, group extension, lifting automorphisms, regular covering projection, voltage"
97,97,"alpha-resolvable G-design, alpha-parallel class, (K_4 - e)-design","alpha-resolvable g-design, alpha-parallel class, (k_4 -e)-design"
98,98,"amilton-connected, Hamilton-laceable, Cayley graphs, generalized dihedral group, honeycomb toroidal graph","amilton-connected, hamilton-laceable, cayley graphs, generalized dihedral group, honeycomb toroidal graph"
99,99,"Anonymity, privacy, social network","anonymity, privacy, social network"
100,100,"antimatroid, polyhedron, convex dimension, lattice animal, polyomino","antimatroid, polyhedron, convex dimension, lattice animal, polyomino"
101,101,"Antipodal graph, association scheme, distance regular graph of diameter 3, Godsil-Hensel matrix, group ring, Taylor graph, two-graph.","antipodal graph, association scheme, distance regular graph of diameter 3, godsil-hensel matrix, group ring, taylor graph, two-graph."
102,102,"Antipodal graph, automorphism group, association scheme, conference matrix, distance regular cover, generalized Hadamard matrix, Godsil-Hensel matrix, group ring, Foster graph, Mathieu group, Payne's doily, resolvable transversal design, Schur multiplier","antipodal graph, automorphism group, association scheme, conference matrix, distance regular cover, generalized hadamard matrix, godsil-hensel matrix, group ring, foster graph, mathieu group, payne's doily, resolvable transversal design, schur multiplier"
103,103,"Arc-transitive graph, covering graph, 2-transitive group","arc-transitive graph, covering graph, 2-transitive group"
104,104,"Arc-transitive graph, normal quotient, automorphism group","arc-transitive graph, normal quotient, automorphism group"
105,105,"Arc-transitive graphs, polycirculant conjecture, semiregular automorphism","arc-transitive graphs, polycirculant conjecture, semiregular automorphism"
106,106,"Arc-transitive, circulant, quasi m-Cayley graph.","arc-transitive, circulant, quasi m-cayley graph."
107,107,"Area evolute, Barbier's theorem, center symmetry set, curvature, curves of constant width, discrete differential geometry, evolutes, Minkowski geometry, normed plane, equidistants, involutes, support function, width function","area evolute, barbier's theorem, center symmetry set, curvature, curves of constant width, discrete differential geometry, evolutes, minkowski geometry, normed plane, equidistants, involutes, support function, width function"
108,108,"Arrangement of lines, configuration of lines","arrangement of lines, configuration of line"
109,109,"Arrangement, congruent triangles","arrangement, congruent triangle"
110,110,"arrangement, simplicial, sporadic","arrangement, simplicial, sporadic"
111,111,"Association scheme, coherent configuration, regular weight, double cover, two-graph, t-graph","association scheme, coherent configuration, regular weight, double cover, two-graph, t-graph"
112,112,"association scheme, permutation group, algebraic computation","association scheme, permutation group, algebraic computation"
113,113,"Association schemes, groups","association schemes, group"
114,114,"Association schemes, p-schemes","association schemes, p-scheme"
115,115,"Automorphism group, balanced hypercube, Cayley graph, arc-transitive","automorphism group, balanced hypercube, cayley graph, arc-transitive"
116,116,"Bargraphs, levels, generating functions, asymptotics.","bargraphs, levels, generating functions, asymptotics."
117,117,"Bernoulli numbers, hypergeometric Bernoulli numbers, hypergeometric Cauchy numbers, hypergeometric functions, degenerate Bernoulli numbers, determinants, recurrence relations","bernoulli numbers, hypergeometric bernoulli numbers, hypergeometric cauchy numbers, hypergeometric functions, degenerate bernoulli numbers, determinants, recurrence relation"
118,118,"Bi-Cayley graph, half-arc-transitive graph, metacyclic group","bi-cayley graph, half-arc-transitive graph, metacyclic group"
119,119,"Bi-p-metacirculant, edge-transitive, inner-abelian p-group","bi-p-metacirculant, edge-transitive, inner-abelian p-group"
120,120,"Biembedding, orientable surface, twofold triple system","biembedding, orientable surface, twofold triple system"
121,121,"Bigraphs, cross-matching, halving lines, perfect matchings","bigraphs, cross-matching, halving lines, perfect matching"
122,122,"Binomial coefficients, divisibility, primorials","binomial coefficients, divisibility, primorials"
123,123,"Binomial sum, integral representation, probabilistic analysis, unbalanced coin","binomial sum, integral representation, probabilistic analysis, unbalanced coin"
124,124,"Bipartite graphs, edge-transitive embeddings","bipartite graphs, edge-transitive embedding"
125,125,"Bockting operator, tridiagonal pair, Leonard pair","bockting operator, tridiagonal pair, leonard pair"
126,126,"Cartesian product, quasi product, graph bundle, approximate product, partial star product, product relation.","cartesian product, quasi product, graph bundle, approximate product, partial star product, product relation."
127,127,"Catalan numbers, logarithm, generating function, Stirling number","catalan numbers, logarithm, generating function, stirling number"
128,128,"Categorical product, chromatic number, Hedetniemi's conjecture, general Kneser hypergraph","categorical product, chromatic number, hedetniemi's conjecture, general kneser hypergraph"
129,129,"Cayley digraph, reachability relation","cayley digraph, reachability relation"
130,130,Cayley graph,cayley graph
131,131,"Cayley graph, abelian group, automorphism group, asymptotic, p-group","cayley graph, abelian group, automorphism group, asymptotic, p-group"
132,132,"Cayley graph, automorphism, colour-preserving, colour-permuting","cayley graph, automorphism, colour-preserving, colour-permuting"
133,133,"Cayley graph, diameter of a graph, abelian group, G-graph, expander family","cayley graph, diameter of a graph, abelian group, g-graph, expander family"
134,134,"Cayley graph, distance-regular graph","cayley graph, distance-regular graph"
135,135,"Cayley graph, half-arc-transitive graph, automorphism group","cayley graph, half-arc-transitive graph, automorphism group"
136,136,"Cayley graph, half-arc-transitive graph, transitive graph","cayley graph, half-arc-transitive graph, transitive graph"
137,137,"Cayley graph, hamiltonian cycle","cayley graph, hamiltonian cycle"
138,138,"Cayley graph, hamiltonian cycle, commutator subgroup","cayley graph, hamiltonian cycle, commutator subgroup"
139,139,"Cayley graphs, CI-groups.","cayley graphs, ci-groups."
140,140,"Cayley graphs, hamiltonian cycles","cayley graphs, hamiltonian cycle"
141,141,"Cayley graphs, vertex-transitive graphs, sensitivity conjecture","cayley graphs, vertex-transitive graphs, sensitivity conjecture"
142,142,"Cayley map, skew morphism, smooth subgroup","cayley map, skew morphism, smooth subgroup"
143,143,"CCA problem, Cayley graphs, edge-colouring, Sylow cyclic groups","cca problem, cayley graphs, edge-colouring, sylow cyclic group"
144,144,"Centrality measures, betweenness centrality, social networks","centrality measures, betweenness centrality, social network"
145,145,"Chiral 4-polytope, full rank polytope","chiral 4-polytope, full rank polytope"
146,146,"Chiral hypermap, chiral map, harmonic differential, homology group.","chiral hypermap, chiral map, harmonic differential, homology group."
147,147,"chiral polytope, regular and chiral","chiral polytope, regular and chiral"
148,148,"Chord diagram, chord expansion, Genocchi number, Seidel triangle","chord diagram, chord expansion, genocchi number, seidel triangle"
149,149,"Chromatic number, circular chromatic number, Kneser graph, stable Kneser graph","chromatic number, circular chromatic number, kneser graph, stable kneser graph"
150,150,"Chromatic number, colouring number, Szekeres-Wilf inequality, NP-completeness","chromatic number, colouring number, szekeres-wilf inequality, np-completeness"
151,151,"chromatic number, independence ratio, crossing number, dependent crossings","chromatic number, independence ratio, crossing number, dependent crossing"
152,152,"CI-group, ternary relation","ci-group, ternary relation"
153,153,"Circulant graph, automorphism group, Cayley graph, DRR, GRR.","circulant graph, automorphism group, cayley graph, drr, grr."
154,154,"Cluster algebra, maximal green sequence, direct sum","cluster algebra, maximal green sequence, direct sum"
155,155,"Coherent configurations, association schemes, prime order, symmetric designs","coherent configurations, association schemes, prime order, symmetric design"
156,156,"Combinatorial problems, numerical semigroups, Frobenius varieties, Frobenius pseudo-varieties","combinatorial problems, numerical semigroups, frobenius varieties, frobenius pseudo-variety"
157,157,"Commutator, cycle, permutation, alternating group.","commutator, cycle, permutation, alternating group."
158,158,"Commuting graph, matrix ring, centralizer.","commuting graph, matrix ring, centralizer."
159,159,"Complete bipartite graphs, reflexible edge-transitive embedding","complete bipartite graphs, reflexible edge-transitive embedding"
160,160,"complete equipartite graph, distinguishing number, distinguishing partition, asymmetric uniform hypergraph","complete equipartite graph, distinguishing number, distinguishing partition, asymmetric uniform hypergraph"
161,161,"Complete multipartite graph, distinguishing partition, combinatorial species, tree enumeration.","complete multipartite graph, distinguishing partition, combinatorial species, tree enumeration."
162,162,"Composition, partition, subset sum, polynomials, finite fields, character, finite abelian groups.","composition, partition, subset sum, polynomials, finite fields, character, finite abelian groups."
163,163,"Computational methods in group theory, lattices of subgroups","computational methods in group theory, lattices of subgroup"
164,164,"Computer algebra system, GAP, COCO, coherent configuration, association scheme, strongly regular graph, algebraic automorphism, total graph, Moore graph, Doyle-Holt graph, Gray configuration, generalized quadrangle","computer algebra system, gap, coco, coherent configuration, association scheme, strongly regular graph, algebraic automorphism, total graph, moore graph, doyle-holt graph, gray configuration, generalized quadrangle"
165,165,configuration,configuration
166,166,"Configuration of points and lines, unsplittable configuration, unsplittable graph, independent set, Levi graph, Grünbaum graph, splitting type, cyclic Haar graph","configuration of points and lines, unsplittable configuration, unsplittable graph, independent set, levi graph, grünbaum graph, splitting type, cyclic haar graph"
167,167,"Configuration, irreducible, partial linear space, construction, enumeration.","configuration, irreducible, partial linear space, construction, enumeration."
168,165,configurations,configuration
169,168,"Configurations, incidence geometry","configurations, incidence geometry"
170,169,"Configurations, trilaterals","configurations, trilateral"
171,170,"Configurations, trilaterals, matroids","configurations, trilaterals, matroid"
172,171,Configurations.,configurations.
173,172,"Congruent transformation, positive (negative) inertia index, nullity","congruent transformation, positive (negative) inertia index, nullity"
174,173,"Connected dominating set, connected domination, connected-domishold graph, forbidden induced subgraph characterization, split graph, chordal graph, minimal cutset, minimal separator, 1-Sperner hypergraph, threshold hypergraph, threshold Boolean function","connected dominating set, connected domination, connected-domishold graph, forbidden induced subgraph characterization, split graph, chordal graph, minimal cutset, minimal separator, 1-sperner hypergraph, threshold hypergraph, threshold boolean function"
175,174,"connectivity, Cartesian product","connectivity, cartesian product"
176,175,"Consistent graphs, balanced signed graphs, balanced labelings of graphs, gain graphs, weighted graphs","consistent graphs, balanced signed graphs, balanced labelings of graphs, gain graphs, weighted graph"
177,176,"Corona graph, cubic graph, equitable chromatic number, equitable graph coloring, NP-hardness, polynomial algorithm","corona graph, cubic graph, equitable chromatic number, equitable graph coloring, np-hardness, polynomial algorithm"
178,177,"Counting of homomorphisms, Non-equivalent coverings, Disconnected coverings, Fundamental group, Euler transform","counting of homomorphisms, non-equivalent coverings, disconnected coverings, fundamental group, euler transform"
179,178,"Covering projection, canonical cover, regular cover, automorphisms","covering projection, canonical cover, regular cover, automorphism"
180,179,"Covering projection, graph, group extension, lifting automorphisms, voltage assignment","covering projection, graph, group extension, lifting automorphisms, voltage assignment"
181,180,"Coxeter group, embedding","coxeter group, embedding"
182,181,"Coxeter system, Cayley graph.","coxeter system, cayley graph."
183,182,"critical independent set, critical independence number, independence number, matching number, König-Egerváry graph","critical independent set, critical independence number, independence number, matching number, könig-egerváry graph"
184,183,"crossing number, genus","crossing number, genus"
185,184,"Cubic graph, 2-factor, long cycle, snark, infinite graph","cubic graph, 2-factor, long cycle, snark, infinite graph"
186,185,"Cubic graph, cyclic connectivity, edge-colouring, snark, oddness, computation","cubic graph, cyclic connectivity, edge-colouring, snark, oddness, computation"
187,186,"Cubic graph, perfect matching, oddness, Fan-Raspaud Conjecture, Berge-Fulkerson Conjecture, Petersen-colouring","cubic graph, perfect matching, oddness, fan-raspaud conjecture, berge-fulkerson conjecture, petersen-colouring"
188,187,"Cubic graph, Petersen graph, Petersen coloring conjecture, S_10-conjecture","cubic graph, petersen graph, petersen coloring conjecture, s_10-conjecture"
189,188,cycle basis,cycle base
190,189,"Cycle space, Cycle basis, lexicographic product","cycle space, cycle basis, lexicographic product"
191,190,"Cycle space, Cycle basis, robust, quasi-robust, Kainen's Basis, elementary cycle, complete bipartite, Cartesian product","cycle space, cycle basis, robust, quasi-robust, kainen's basis, elementary cycle, complete bipartite, cartesian product"
192,191,"Cyclic group, permutation group, skew-morphism, Schur ring","cyclic group, permutation group, skew-morphism, schur ring"
193,192,"Degree-diameter problem, Cayley graphs, circulant graphs, sumsets","degree-diameter problem, cayley graphs, circulant graphs, sumset"
194,193,"Dessins d'enfants, Belyi curves, Algebraic curves, Riemann Surfaces","dessins d'enfants, belyi curves, algebraic curves, riemann surface"
195,194,"Dessins d'enfants, Riemann surfaces, field of moduli and field of definition","dessins d'enfants, riemann surfaces, field of moduli and field of definition"
196,195,"Dessins d'enfants, Wada dessins, bipartite graphs, graph embeddings, difference sets, finite geometries, Riemann surfaces, Frobenius automorphism, Singer groups","dessins d'enfants, wada dessins, bipartite graphs, graph embeddings, difference sets, finite geometries, riemann surfaces, frobenius automorphism, singer group"
197,196,"Determinant, permanent, Hessenberg matrix","determinant, permanent, hessenberg matrix"
198,197,"Digraph, automorphism group, permutation group, direct product","digraph, automorphism group, permutation group, direct product"
199,198,"Digraph, complete tripartite graph, directed genus, surfaces","digraph, complete tripartite graph, directed genus, surface"
200,199,"Digraph, non-negative spectrum, multigraph, cospectrality, isomorphism","digraph, non-negative spectrum, multigraph, cospectrality, isomorphism"
201,200,"Digraphs, consistent directed cycles","digraphs, consistent directed cycle"
202,201,"Digraphs, vertex-quasiprimitive, 2-arc-transitive","digraphs, vertex-quasiprimitive, 2-arc-transitive"
203,202,"Dihedral f-tilings, combinatorial properties, spherical trigonometry, symmetry groups","dihedral f-tilings, combinatorial properties, spherical trigonometry, symmetry group"
204,203,"Dihedral f-tilings, combinatorial properties, spherical trigonometry, symmetry groups.","dihedral f-tilings, combinatorial properties, spherical trigonometry, symmetry groups."
205,204,"Directed graphs, Turán numbers, intersection graphs of families of boxes","directed graphs, turán numbers, intersection graphs of families of boxes"
206,205,"Discriminantal arrangements, intersection lattice, Grassmannian, Pappus's Theorem","discriminantal arrangements, intersection lattice, grassmannian, pappus's theorem"
207,206,"Dissociation number, well-covered graphs, girth, Moore graph, polarity graph","dissociation number, well-covered graphs, girth, moore graph, polarity graph"
208,207,"Distance magic labeling, group labeling, strong product of graphs","distance magic labeling, group labeling, strong product of graph"
209,208,Distance spectrum,distance spectrum
210,209,"Distance spectrum, Cartesian product, lexicographic product, Hamming graphs, C4 nanotori","distance spectrum, cartesian product, lexicographic product, hamming graphs, c4 nanotori"
