kid,kid2,keyword,normalized
558,557,"Thickness, Kronecker product graph, planar decomposition","thickness, kronecker product graph, planar decomposition"
559,558,"Thickness, planar decomposition, girth, complete graph","thickness, planar decomposition, girth, complete graph"
560,559,"Tiling, domino, hyperbolic mosaic, Fibonacci numbers, combinatorial identity","tiling, domino, hyperbolic mosaic, fibonacci numbers, combinatorial identity"
561,560,"Tilings, equitransitive, unilateral, squares.","tilings, equitransitive, unilateral, squares."
562,561,"Topological graph theory, current graphs, map coloring, triangulations","topological graph theory, current graphs, map coloring, triangulation"
563,562,"Topological graph theory, graph genus polynomials, log-concavity, real-rootedness","topological graph theory, graph genus polynomials, log-concavity, real-rootedness"
564,563,"Total colourings of graphs,  symmetry breaking in graphs, total distinguishing number, total distinguishing chromatic number","total colourings of graphs, symmetry breaking in graphs, total distinguishing number, total distinguishing chromatic number"
565,564,"Total domination number, annihilation number, cactus graph, block graph","total domination number, annihilation number, cactus graph, block graph"
566,565,"Total domination number, disjoint total dominating sets","total domination number, disjoint total dominating set"
567,566,"Total domination number, Fibonacci cube, hypercube, integer linear programming, covering codes","total domination number, fibonacci cube, hypercube, integer linear programming, covering code"
568,567,"Total positivity, totally positive matrix, Toeplitz matrix, Hankel matrix, hyperfibonacci sequence, log-concavity","total positivity, totally positive matrix, toeplitz matrix, hankel matrix, hyperfibonacci sequence, log-concavity"
569,568,"Transit function, ranked poset, underlying graph, geodesic interval, induced-path interval","transit function, ranked poset, underlying graph, geodesic interval, induced-path interval"
570,569,"Transit functions, convexities, hierarchies, rooted trees, axiom   systems","transit functions, convexities, hierarchies, rooted trees, axiom  system"
571,570,"Transitive groups, generation, expectation","transitive groups, generation, expectation"
572,571,triangle group,triangle group
573,572,"Truncation, automorphism group, Cayley graph, Hamiltonian.","truncation, automorphism group, cayley graph, hamiltonian."
574,573,"Truncation, vertex-transitive, Cayley graph, automorphism group","truncation, vertex-transitive, cayley graph, automorphism group"
575,574,"Uniform map, equivelar map, dessin d'enfants, configuration of points and circles","uniform map, equivelar map, dessin d'enfants, configuration of points and circles"
576,575,"Uniform poset, dual polar graph, dual polar space, down-up algebra","uniform poset, dual polar graph, dual polar space, down-up algebra"
577,576,"Unital, embedding, finite Desarguesian plane","unital, embedding, finite desarguesian plane"
578,577,"Unitals, Moulton planes","unitals, moulton plane"
579,578,"Unitary groups, Möbius function, subgroup lattice","unitary groups, möbius function, subgroup lattice"
580,579,"Unramified Brauer group, Bogomolov multiplier, isoclinism.","unramified brauer group, bogomolov multiplier, isoclinism."
581,580,"Upper embedding, Steiner triple system, Latin square","upper embedding, steiner triple system, latin square"
582,581,"V-construction, unit-distance graph, isometric point-circle configuration","v-construction, unit-distance graph, isometric point-circle configuration"
583,582,"Vertex coloring, color classes, Cayley graph","vertex coloring, color classes, cayley graph"
584,583,"Vertex colouring, symmetry breaking in graph, distinguishing number, vertex-transitive graphs","vertex colouring, symmetry breaking in graph, distinguishing number, vertex-transitive graph"
585,584,vertex-transitive graph,vertex-transitive graph
586,585,"Vertex-transitive graph, Hamilton cycle, automorphism group, orbital graph","vertex-transitive graph, hamilton cycle, automorphism group, orbital graph"
587,586,"Virtual links, string links, cobordism, concordance, welded knots","virtual links, string links, cobordism, concordance, welded knot"
588,587,"Vizing's conjecture, domination number, independence-domination number, weakly chordal graph, NP-completeness, hereditary graph class, IDD-perfect graph.","vizing's conjecture, domination number, independence-domination number, weakly chordal graph, np-completeness, hereditary graph class, idd-perfect graph."
589,588,"Weighted k-cyclic graph, adjacency matrix, inertia","weighted k-cyclic graph, adjacency matrix, inertia"
590,589,"Wiener index, iterated line graph, tree, claw","wiener index, iterated line graph, tree, claw"
591,590,"Wiener index, Wiener inverse interval problem, tree","wiener index, wiener inverse interval problem, tree"
592,591,"Wiener index, Wiener polynomial, Wiener number,composite graph, graph product","wiener index, wiener polynomial, wiener number,composite graph, graph product"
593,592,"Wiener number, Hosoya polynomial, Wiener polynomial, edge contributions, communication network, cactus graph, linear algorithm","wiener number, hosoya polynomial, wiener polynomial, edge contributions, communication network, cactus graph, linear algorithm"
594,593,"Wreath product of complete graphs, adjacency matrix, distance matrix, spectrum, distance spectrum, Wiener index","wreath product of complete graphs, adjacency matrix, distance matrix, spectrum, distance spectrum, wiener index"
595,594,"Z_3-connectivity, K_{1, 3}-free, nowhere-zero 3-flow","z_3-connectivity, k_{1, 3}-free, nowhere-zero 3-flow"
596,595,NA,NO KEYWORDS
