kid,kid2,keyword,normalized
211,210,"Distance-balanced graph, pTS-distance-balanced graph, total distance, wreath product of graphs","distance-balanced graph, pts-distance-balanced graph, total distance, wreath product of graph"
212,211,"Distance-regular graph, Terwilliger algebra, subconstituent algebra","distance-regular graph, terwilliger algebra, subconstituent algebra"
213,212,"distance-transitive graph, ultrahomogeneous graph,  Cayley graph","distance-transitive graph, ultrahomogeneous graph, cayley graph"
214,213,"Distance, radius, eccentricity, proximity, remoteness.","distance, radius, eccentricity, proximity, remoteness."
215,214,"Distant sum distinguishing index of a graph, neighbour sum distinguishing index, adjacent strong chromatic index, distant set distinguishing index","distant sum distinguishing index of a graph, neighbour sum distinguishing index, adjacent strong chromatic index, distant set distinguishing index"
216,215,"Distinguishing chromatic number, automorphism group of a graph, Motion Lemma,  weak product of graphs","distinguishing chromatic number, automorphism group of a graph, motion lemma, weak product of graph"
217,216,"Distinguishing chromatic number, vertex transitive graphs, Cayley graphs","distinguishing chromatic number, vertex transitive graphs, cayley graph"
218,217,"Distinguishing index, automorphism, infinite graph, edge colouring, infinite dimensional hypercube","distinguishing index, automorphism, infinite graph, edge colouring, infinite dimensional hypercube"
219,218,"Distinguishing number, automorphisms, infinite graphs","distinguishing number, automorphisms, infinite graph"
220,219,"Distinguishing number, graph automorphism, combinatorial game","distinguishing number, graph automorphism, combinatorial game"
221,220,"Distinguishing number, group action, stabilizer, motion","distinguishing number, group action, stabilizer, motion"
222,221,"Dominating set, domination number, Kneser graph.","dominating set, domination number, kneser graph."
223,222,"Dominating set, finite generalized quadrangle","dominating set, finite generalized quadrangle"
224,223,"dominating set, triangulation, graphs on surfaces, non-contractible cycle, non-orientable surface","dominating set, triangulation, graphs on surfaces, non-contractible cycle, non-orientable surface"
225,224,"Domination game, game domination number, paths, cycles","domination game, game domination number, paths, cycle"
226,225,"Domination, global domination,  locating domination, complement graph, block-cactus.","domination, global domination, locating domination, complement graph, block-cactus."
227,226,"Domination, partial product graph, Cartesian product graph, strong product graph, Vizing's conjecture","domination, partial product graph, cartesian product graph, strong product graph, vizing's conjecture"
228,227,"Double nested graph, signless Laplacian, largest eigenvalue, spectral inequalities.","double nested graph, signless laplacian, largest eigenvalue, spectral inequalities."
229,228,"Dual polar graphs, automorphism group, quadratic form, isotropic subspace","dual polar graphs, automorphism group, quadratic form, isotropic subspace"
230,229,"Edge coloring, Keller graphs, Mycielski graphs, queen graphs, Hamiltonian, class one","edge coloring, keller graphs, mycielski graphs, queen graphs, hamiltonian, class one"
231,230,"Edge coloring, odd subgraph, edge decompositon.","edge coloring, odd subgraph, edge decompositon."
232,231,"Edge colouring, polytopes, Cayley graps","edge colouring, polytopes, cayley graph"
233,232,"Edge colouring, rainbow subgraph.","edge colouring, rainbow subgraph."
234,233,"Edge colouring, symmetry breaking in graph, distinguishing index, claw-free graph, planar graph","edge colouring, symmetry breaking in graph, distinguishing index, claw-free graph, planar graph"
235,234,"Edge colouring, symmetry breaking, distinguishing index,  Cartesian product of graphs","edge colouring, symmetry breaking, distinguishing index, cartesian product of graph"
236,235,"Edge-colouring, critical graph, Möbius strip","edge-colouring, critical graph, möbius strip"
237,236,"Edge-transitive graph, oriented graph, cyclic quotient graph, transitive group","edge-transitive graph, oriented graph, cyclic quotient graph, transitive group"
238,237,"Edge-transitive map, edge-transitive tessellation, map on surface, symmetry type graph","edge-transitive map, edge-transitive tessellation, map on surface, symmetry type graph"
239,238,"Edge-transitive map, enumeration, hyperbolic plane","edge-transitive map, enumeration, hyperbolic plane"
240,239,"Efficient enumeration, rooted maps, orientable genus, generating functions","efficient enumeration, rooted maps, orientable genus, generating function"
241,240,"eigenvalue, eigenspace, hamming graph, cayley graph","eigenvalue, eigenspace, hamming graph, cayley graph"
242,241,"Eigenvalues of graphs, bipartite graphs","eigenvalues of graphs, bipartite graph"
243,242,"Eigenvector, adjacency matrix, Wilf's problem","eigenvector, adjacency matrix, wilf's problem"
244,243,"Embedded graphs, medial, components of links.","embedded graphs, medial, components of links."
245,244,"Embedding dimension, Frobenius number, genus, multiplicity, numerical semigroup","embedding dimension, frobenius number, genus, multiplicity, numerical semigroup"
246,245,"Enumeration, surface, genus, rooted hypermap, unrooted hypermap","enumeration, surface, genus, rooted hypermap, unrooted hypermap"
247,246,"Enumeration, Surface, Orbifold, Rooted map, Unrooted map, Fuchsian group","enumeration, surface, orbifold, rooted map, unrooted map, fuchsian group"
248,247,"Equivelar polyhedron, Leonardo polyhedron, regular polyhedron, genus, Schläfli symbol, symmetry group.","equivelar polyhedron, leonardo polyhedron, regular polyhedron, genus, schläfli symbol, symmetry group."
249,248,"Erdős-Sós Conjecture, Conjecture, tree, maximum degree","erdős-sós conjecture, conjecture, tree, maximum degree"
250,249,"Euler divergent series, Abel-Plana Formula, Stirling numbers, spin system, Ising chain","euler divergent series, abel-plana formula, stirling numbers, spin system, ising chain"
251,250,"Even and odd restricted permutations, exact enumeration, recurrences, permanents.","even and odd restricted permutations, exact enumeration, recurrences, permanents."
252,251,"Expected value, average value, Kirchhoff index, resistance distance, polyphenyl chain, spiro chain.","expected value, average value, kirchhoff index, resistance distance, polyphenyl chain, spiro chain."
253,252,"Extensional digraph, transitive set, set theory, random generation, Markov chain.","extensional digraph, transitive set, set theory, random generation, markov chain."
254,253,"Extremal graph, path, push to leaves","extremal graph, path, push to leave"
255,254,"Face-homogeneous, tessellation, growth rate, valence sequence, exponential growth, transition matrix, Bilinski diagram, hyperbolic plane","face-homogeneous, tessellation, growth rate, valence sequence, exponential growth, transition matrix, bilinski diagram, hyperbolic plane"
256,255,"Fano configuration, Pappus, Desargues, (n, 3)-configuration","fano configuration, pappus, desargues, (n, 3)-configuration"
257,256,"Fibonacci cubes, domination number, total domination number, integer linear programming","fibonacci cubes, domination number, total domination number, integer linear programming"
258,257,"Fibonacci cubes, Lucas cubes, domination number, 2-packing number","fibonacci cubes, lucas cubes, domination number, 2-packing number"
259,258,"Finite simple graph, edge polytope","finite simple graph, edge polytope"
260,259,"First Zagreb index, Second Zagreb index.","first zagreb index, second zagreb index."
261,260,"Flexible polygons, configuration spaces, Morse index, critical points","flexible polygons, configuration spaces, morse index, critical point"
262,261,"Forbidden configuration, hypergraph, trace, NP-hard, NP-complete, Anstee-Sali conjecture.","forbidden configuration, hypergraph, trace, np-hard, np-complete, anstee-sali conjecture."
263,262,"Frobenius group, (orientably) regular map, automorphism group","frobenius group, (orientably) regular map, automorphism group"
264,263,"Fullerene, cubic graph, planar graph, topological indices","fullerene, cubic graph, planar graph, topological index"
265,264,"Fullerene, patch, stability, isolated pentagon rule, Kekulé structure, conjugated cycle, cyclic edge-cut","fullerene, patch, stability, isolated pentagon rule, kekulé structure, conjugated cycle, cyclic edge-cut"
266,265,"Fullerene, resonance graph, Zhang-Zhang polynomial","fullerene, resonance graph, zhang-zhang polynomial"
267,266,"Fullerenes, fullerene patches, ambiguous patches, graphite patches","fullerenes, fullerene patches, ambiguous patches, graphite patch"
268,267,"Fullerenes, Fullerene Patches, boundary codes, pseudoconvex patches","fullerenes, fullerene patches, boundary codes, pseudoconvex patch"
269,268,"Fullerenes, fullerene patches, boundary codes, pseudoconvex patches.","fullerenes, fullerene patches, boundary codes, pseudoconvex patches."
270,269,"Fullerenes, fullerene patches, pseudoconvex patches","fullerenes, fullerene patches, pseudoconvex patch"
271,270,"Gauss words, Gauss codes, Gauss paragraphs, good characterization","gauss words, gauss codes, gauss paragraphs, good characterization"
272,271,"General position problem, Kneser graphs, intersection theorems","general position problem, kneser graphs, intersection theorem"
273,272,"Generalized Cayley graph, natural isomorphism, GCI-group, Cayley regression","generalized cayley graph, natural isomorphism, gci-group, cayley regression"
274,273,Generalized line graph,generalized line graph
275,274,"Generalized Petersen graphs, I-graphs, Hamiltonian cycles, Eulerian tours, Cayley multigraphs","generalized petersen graphs, i-graphs, hamiltonian cycles, eulerian tours, cayley multigraph"
276,275,"Generalized surjective graph homomorphism,    R-reduced graph, R-retraction,   binary relation, multihomomorphism, R-core, cocore","generalized surjective graph homomorphism,   r-reduced graph, r-retraction,   binary relation, multihomomorphism, r-core, cocore"
277,276,genus,genus
278,277,"Genus distribution, Halin graph, partitioned genus distribution, gram embedding, outerplanar graph, topological graph theory.","genus distribution, halin graph, partitioned genus distribution, gram embedding, outerplanar graph, topological graph theory."
279,278,"Genus distribution, partial genus distribution, treewidth, tree decomposition","genus distribution, partial genus distribution, treewidth, tree decomposition"
280,279,"Genus distribution, rooted-graph, production, partitioned genus distribution, 3-prism, 3-wheel.","genus distribution, rooted-graph, production, partitioned genus distribution, 3-prism, 3-wheel."
281,280,"Geodetic problem, strong geodetic problem, (complete) bipartite graphs, (complete) multipartite graphs","geodetic problem, strong geodetic problem, (complete) bipartite graphs, (complete) multipartite graph"
282,281,"Geometric configurations, incidence structures","geometric configurations, incidence structures"
283,282,"geometric graph, homomorphism, poset","geometric graph, homomorphism, poset"
284,283,"Golomb ruler, optical orthogonal code, difference family","golomb ruler, optical orthogonal code, difference family"
285,284,"Graovac-Pisanski index, modified Wiener index, unicyclic graphs","graovac-pisanski index, modified wiener index, unicyclic graph"
286,285,graph,graph
287,302,"Graph  producs, graph operations, cancellation in graph products","graph producs, graph operations, cancellation in graph product"
288,303,"Graph  product,  Cartesian skeleton, prime factorization of graphs, graph algorithms","graph product,  cartesian skeleton, prime factorization of graphs, graph algorithm"
289,286,"Graph algorithm, community detection, the Petford-Welsh algorithm, simulated annealing, complex networks","graph algorithm, community detection, the petford-welsh algorithm, simulated annealing, complex network"
290,287,"Graph coloring, approximation algorithm, frequency planning, cellular networks.","graph coloring, approximation algorithm, frequency planning, cellular networks."
291,288,"Graph Coloring, Canonical coloring","graph coloring, canonical coloring"
292,289,"graph colouring, cyclic Gray code","graph colouring, cyclic gray code"
293,290,"graph direct product, minimum cycle bases, digraphs","graph direct product, minimum cycle bases, digraph"
294,291,"Graph distance, Wiener index, average distance, topological index, molecular descriptor, chemical graph theory","graph distance, wiener index, average distance, topological index, molecular descriptor, chemical graph theory"
295,292,"Graph distances, homometric subsets, Golumb ruler","graph distances, homometric subsets, golumb ruler"
296,293,"Graph drawing, crossing number","graph drawing, crossing number"
297,294,"Graph eigenvalues, double comet, extremal values, numerical computation","graph eigenvalues, double comet, extremal values, numerical computation"
298,295,"Graph embedding, genus","graph embedding, genus"
299,296,"Graph embedding, resistance, snark, superposition","graph embedding, resistance, snark, superposition"
300,297,"Graph factorization, affine and projective spaces, spread.","graph factorization, affine and projective spaces, spread."
301,298,"Graph imbedding, genus polynomial, production matrix, transfer matrix method","graph imbedding, genus polynomial, production matrix, transfer matrix method"
302,299,"Graph isomorphism, cyclic Haar graph, 4-BCI-group","graph isomorphism, cyclic haar graph, 4-bci-group"
303,300,"Graph List-Coloring, Coloring Extendability, Outerplanar Graphs","graph list-coloring, coloring extendability, outerplanar graph"
304,301,"Graph operations, hierarchical diamond lattice, JLS model, financial bubbles and crashes, ARMA/GARCH errors","graph operations, hierarchical diamond lattice, jls model, financial bubbles and crashes, arma/garch errors"
305,304,"Graph products, algorithms.","graph products, algorithms."
306,305,"Graph products, Markov chains, cycle spaces","graph products, markov chains, cycle space"
307,306,"Graph spectrum, integral graph, Cayley graph, arc-transitive, vertex-transitive bipartite double cover, voltage assignment, graph homomorphism.","graph spectrum, integral graph, cayley graph, arc-transitive, vertex-transitive bipartite double cover, voltage assignment, graph homomorphism."
308,307,"Graph theory, 2D rectangular and polygonal lattices, Wiener index, Compression ratio","graph theory, 2d rectangular and polygonal lattices, wiener index, compression ratio"
309,308,"Graph theory, polyhedra, symmetry, chamber systems","graph theory, polyhedra, symmetry, chamber system"
310,309,"graph, automorphism group, symmetry, edge-transitive graph, regular map, tetravalent graph, rose window","graph, automorphism group, symmetry, edge-transitive graph, regular map, tetravalent graph, rose window"
311,310,"Graph, automorphism group, symmetry, locally arc-transitive graph, semisymmetric graph, cycle structure, linking ring structure","graph, automorphism group, symmetry, locally arc-transitive graph, semisymmetric graph, cycle structure, linking ring structure"
312,311,"Graph, automorphism group, symmetry, locally arc-transitive graph, semisymmetric graph, cycle structure, linking rings structure","graph, automorphism group, symmetry, locally arc-transitive graph, semisymmetric graph, cycle structure, linking rings structure"
313,312,"Graph, cubic, semiregular automorphism, tricirculant, vertex-transitive","graph, cubic, semiregular automorphism, tricirculant, vertex-transitive"
314,313,"Graph, digraph, arc-transitive, order.","graph, digraph, arc-transitive, order."
315,314,"Graph, digraph, edge-transitive, vertex-transitive, arc-transitive, half-arc-transitive","graph, digraph, edge-transitive, vertex-transitive, arc-transitive, half-arc-transitive"
316,315,"Graph, distinguishing labeling, automorphism group","graph, distinguishing labeling, automorphism group"
317,316,"Graph, edge-transitive, vertex-transitive, half-arc-transitive.","graph, edge-transitive, vertex-transitive, half-arc-transitive."
318,317,"Graph, Euclidean distance matrix, distance, eigenvalue.","graph, euclidean distance matrix, distance, eigenvalue."
319,318,"Graph, first Zagreb eccentricity index, second Zagreb eccentricity index, diameter, eccentricity.","graph, first zagreb eccentricity index, second zagreb eccentricity index, diameter, eccentricity."
320,319,"Graph, genus distribution, edge-amalgamation","graph, genus distribution, edge-amalgamation"
321,320,"Graph, genus distribution, vertex-amalgamation","graph, genus distribution, vertex-amalgamation"
322,321,"Graph, girth-regular, cubic, girth","graph, girth-regular, cubic, girth"
323,322,"Graph, graph minor, surface, near-embedding, grid minor, excluded minor.","graph, graph minor, surface, near-embedding, grid minor, excluded minor."
324,323,"Graph, graphic sequence.","graph, graphic sequence."
325,324,"Graph, Hamiltonian cycle, domination, 3-walk","graph, hamiltonian cycle, domination, 3-walk"
326,325,"Graph, hyperelliptic graph, homology group, Riemann--Hurwitz formula, Schreier formula.","graph, hyperelliptic graph, homology group, riemann--hurwitz formula, schreier formula."
327,326,"Graph, Laplacian spectrum, isospectral graphs, Laplacian polynomial, spanning tree","graph, laplacian spectrum, isospectral graphs, laplacian polynomial, spanning tree"
328,327,"Graph, Map, Enumeration, Asymptotic.","graph, map, enumeration, asymptotic."
329,328,"Graph, polarity graph, degree, diameter, automorphism, group, vertex-transitive graph, Cayley graph.","graph, polarity graph, degree, diameter, automorphism, group, vertex-transitive graph, cayley graph."
330,329,"Graph, tree, matrix, eigenvalues, multiplicities, inverse eigenvalue problem","graph, tree, matrix, eigenvalues, multiplicities, inverse eigenvalue problem"
331,330,"Graph, vertex-transitive, automorphism group,  even permutation, odd permutation","graph, vertex-transitive, automorphism group, even permutation, odd permutation"
332,331,"Graphical zonotope, f-vector, graphical matroid, symmetric function","graphical zonotope, f-vector, graphical matroid, symmetric function"
333,332,"Graphs, canonical double covers, two-fold isomorphisms.","graphs, canonical double covers, two-fold isomorphisms."
334,333,"Graphs, majorization, topological indices, bounds","graphs, majorization, topological indices, bound"
335,334,"graphs, monoids, factorisation","graphs, monoids, factorisation"
336,335,"Graphs, monoids, factorizations, algorithms.","graphs, monoids, factorizations, algorithms."
337,336,"Graphs, regular coverings, voltage assignments, enumeration, Möbius functions (on a lattice), group extensions","graphs, regular coverings, voltage assignments, enumeration, möbius functions (on a lattice), group extension"
338,337,"Grassmann graph, core, pseudo-core, endomorphism, maximal clique","grassmann graph, core, pseudo-core, endomorphism, maximal clique"
339,338,"Group, IP loop, finite embeddability property, local embeddability","group, ip loop, finite embeddability property, local embeddability"
340,339,"Groups, Riemann surface, hypermaps, maps, restrictedly-marked, restrictedly regular","groups, riemann surface, hypermaps, maps, restrictedly-marked, restrictedly regular"
341,340,"Grundy domination number, Grundy total domination number, Kneser graph, zero forcing number, minimum rank","grundy domination number, grundy total domination number, kneser graph, zero forcing number, minimum rank"
342,341,"ℋ-free graph, partition, maximum cut","ℋ-free graph, partition, maximum cut"
343,342,"Hamilton path, Cayley graph, Coxeter group, Hamilton-connected, Hamilton-laceable","hamilton path, cayley graph, coxeter group, hamilton-connected, hamilton-laceable"
344,343,"Hamilton path, Johnson graph, Hamilton-connected.","hamilton path, johnson graph, hamilton-connected."
345,344,"Hamilton-laceable, generalized Petersen graphs, Hamilton-connected, Hamiltonian paths, knight graph, traceable","hamilton-laceable, generalized petersen graphs, hamilton-connected, hamiltonian paths, knight graph, traceable"
346,345,"Hamilton-Waterloo problem, group action, octahedral binary group, dicyclic group, special linear group","hamilton-waterloo problem, group action, octahedral binary group, dicyclic group, special linear group"
347,346,"Hamiltonian cycle, cyclic cycle system, symmetric hamiltonian cycle system, complete multipartite graph","hamiltonian cycle, cyclic cycle system, symmetric hamiltonian cycle system, complete multipartite graph"
348,347,"Hamiltonian, hypohamiltonian, planar, girth, cubic graph, exhaustive generation","hamiltonian, hypohamiltonian, planar, girth, cubic graph, exhaustive generation"
349,348,"Hamming graph, Hamming map, automorphism group, Galois group.","hamming graph, hamming map, automorphism group, galois group."
350,349,"Heffter array, biembedding","heffter array, biembedding"
351,350,"Heffter array, biembedding, multipartite complete graph","heffter array, biembedding, multipartite complete graph"
352,351,"Heffter arrays, biembedding cycle systems","heffter arrays, biembedding cycle system"
353,352,"HL-index, graph spectrum, HOMO-LUMO map","hl-index, graph spectrum, homo-lumo map"
354,353,"Hoffman graph, line graph, graph eigenvalue, special graph","hoffman graph, line graph, graph eigenvalue, special graph"
355,354,"Hoffman graph, line graph, graph eigenvalue, special graph, root system","hoffman graph, line graph, graph eigenvalue, special graph, root system"
356,355,"Hoffman graph, line graph, smallest eigenvalue","hoffman graph, line graph, smallest eigenvalue"
357,356,"Homogenous coloring, mixed hypergraph, bi-hypergraph, NMNR-coloring","homogenous coloring, mixed hypergraph, bi-hypergraph, nmnr-coloring"
358,357,"Hyperbolic geometry, hyperball packings, Dirichlet-Voronoi cell, packing density, Coxeter tilings","hyperbolic geometry, hyperball packings, dirichlet-voronoi cell, packing density, coxeter tiling"
359,359,"Hypermap, automorphism group, monodromy group","hypermap, automorphism group, monodromy group"
360,358,hypermaps,hypermap
361,360,"Hypermaps, maps, hypergraphs, regularity, orientably regular, chirality","hypermaps, maps, hypergraphs, regularity, orientably regular, chirality"
362,361,"Hyperplane arrangement, Smith normal form, Varchenko matrix","hyperplane arrangement, smith normal form, varchenko matrix"
363,362,"Hypohamiltonian, snark, irreducible snark, dot product","hypohamiltonian, snark, irreducible snark, dot product"
364,363,"I-graphs, generalized Petersen graphs, Cauchy-Frobenius-Burnside lemma, arithmetical functions","i-graphs, generalized petersen graphs, cauchy-frobenius-burnside lemma, arithmetical function"
365,364,"Immersion, Hadwiger Conjecture","immersion, hadwiger conjecture"
366,365,"Incidence structure, picture, polyhedral scene, lifting, symmetry, coning","incidence structure, picture, polyhedral scene, lifting, symmetry, coning"
367,366,"Independent sets, graphs, polyhedra, polytopes","independent sets, graphs, polyhedra, polytope"
368,367,"Independent sets, the Tower of Hanoi graph, Sierpiński graph, recursion relation, asymptotic growth constant, asymptotic enumeration","independent sets, the tower of hanoi graph, sierpiński graph, recursion relation, asymptotic growth constant, asymptotic enumeration"
369,368,"Induced forest, acyclic number, planar graph, girth","induced forest, acyclic number, planar graph, girth"
370,369,"Injective coloring, planar graph, square graph","injective coloring, planar graph, square graph"
371,370,"Integer flow, nowhere-zero 3-flow, vertex-transitive graph, acr-transitive graph, solvable group.","integer flow, nowhere-zero 3-flow, vertex-transitive graph, acr-transitive graph, solvable group."
372,371,"Integer flow, nowhere-zero 3-flow, Z_3-connected, modulo 3-orientation, edge-cuts.","integer flow, nowhere-zero 3-flow, z_3-connected, modulo 3-orientation, edge-cuts."
373,372,"Integral graphs, Cayley graphs, graph products","integral graphs, cayley graphs, graph product"
374,373,"Intrinsic linking, complete n-complex, Ramsey theory","intrinsic linking, complete n-complex, ramsey theory"
375,374,"Isomorphisms, DCI-groups, Schur rings","isomorphisms, dci-groups, schur ring"
376,375,"Isomorphisms, Schur rings, p-groups","isomorphisms, schur rings, p-group"
377,376,"Kirchhoff graphs, fundamental theorem of linear algebra, reaction networks.","kirchhoff graphs, fundamental theorem of linear algebra, reaction networks."
378,377,"Klein bottle, wallpaper group, vertex-transitive map","klein bottle, wallpaper group, vertex-transitive map"
379,378,"Kuratowski subgraphs, crossing number, exceptional edges","kuratowski subgraphs, crossing number, exceptional edge"
380,379,"Langford sequence, distance l-labeling, distance J-labeling, delta-sequence, delta-set","langford sequence, distance l-labeling, distance j-labeling, delta-sequence, delta-set"
381,380,"Latin squares, transversals, anti-Ramsey problems, Lovász local lemma","latin squares, transversals, anti-ramsey problems, lovász local lemma"
382,381,"Legendre polynomials, symbolic summation, probability","legendre polynomials, symbolic summation, probability"
383,382,"Line configurations, Hirzebruch inequality, Melchior inequality, Shnurnikov inequality, ball-quotients","line configurations, hirzebruch inequality, melchior inequality, shnurnikov inequality, ball-quotient"
384,383,"Line graphs, s-geodesic transitive graphs, s-arc transitive graphs.","line graphs, s-geodesic transitive graphs, s-arc transitive graphs."
385,384,"Linear code, dimension, distance","linear code, dimension, distance"
386,385,"Linearized polynomial, linear set, direction","linearized polynomial, linear set, direction"
